{
  "schema": "fm-today-card.v1",
  "task_id": "today-t0",
  "kind": "merge",
  "title": "Merge the Today contract",
  "question": "The Today v1 shapes are ready and their checks are green. Merge?",
  "options": [
    {
      "value": "merge",
      "label": "Merge",
      "recommended": true
    },
    {
      "value": "hold",
      "label": "Hold",
      "hint": "Leave the pull request open",
      "recommended": false
    }
  ],
  "repo": "example-org/example-repo",
  "pr_url": "https://github.com/example-org/example-repo/pull/42",
  "text_check": {
    "verdict": "pass",
    "checker": "fm-today-text-check@1.0.0",
    "checked_at": "2026-09-28T14:05:00Z"
  },
  "card_hash": "5e4ba60acc00349cb9283d6ec4fd20fd159676169a30c62b9acd46670dd78b23"
}
